  The DPU-BOOT CSC shall include a DRAM BIT consisting of two write/read/compare tests.  The first test shall write the address of each memory location to that location.  The second test shall write the complement of each memory location to that location.," Startup SequenceThe DPU FSW is booted using PROM-resident bootstrap software.  The bootstrap software performs a basic set of built-in tests, then copies the DPU FSW from EEPROM to DRAM and executes it.  In flight, there are two methods which can trigger the DPU FSW to boot:* power-on (cold boot), or* watchdog reset (warm boot, commanded reboot).",1
  The DPU-BOOT CSC shall include a DRAM BIT consisting of two write/read/compare tests.  The first test shall write the address of each memory location to that location.  The second test shall write the complement of each memory location to that location.,"initial boot sequencethe initial boot sequence, identified as Boot Sequence 1.  This processing takes place when the Bootstrap executes from Programmable Read-Only Memory (PROM).  Boot Sequence 1 is composed primarily of 4 steps as follows.First, in this sequence, EEPROM is updated.  Then, CPU BIT and a portion of DRAM BIT is performed.  Next, DRAM is cleared.  Lastly, Boot Sequence 2 is copied to DRAM and executed. During this sequence, the rest of DRAM is tested if skipBit is not set.  Load parameters are put into registers r13, r14, r15 and r16.  DRAM is cleared up to memSize.  Lastly, either the DPU-RTOS or the Bootstrap Monitor is loaded and executed according to the load parameters.",1
  The DPU-BOOT CSC shall include a DRAM BIT consisting of two write/read/compare tests.  The first test shall write the address of each memory location to that location.  The second test shall write the complement of each memory location to that location.,"DRAM BITPart of the memory is tested in Boot Sequence 1, and part of the memory is tested during Boot Sequence 2.  During Boot Sequence 1, ? KB of DRAM is tested before the Bootstrap is copied to this area.  During Boot Sequence 2, the  remaining memory is tested in ? KB blocks. The DRAM BIT first writes the address of each word in a block to that word in the block.   Then the test flushes the cache and reads back the entire block.  If a single-bit error occurs on the read-back, the location is read again.  If another single-bit error occurs, the test assumes a hard error and marks the whole block bad.  If a multiple-bit error occurs, the whole block is marked bad.  If the value read back does not match the address, the whole block is marked bad.  This same process is repeated with the ones complement of the address. The Bootstrap stores the results of the DRAM BIT in EEPROM as a series of x consecutive y-bit words.  Each bit in a result word represents the result of testing a ? KB block of DRAM.  These bits are mapped to DRAM by proceeding from least-significant bit (LSb) to most-significant bit (MSb) as the addresses of the memory blocks increase.  A set bit indicates that a block of DRAM has failed.  A clear bit indicates that a block of DRAM has passed the test.",1
"  The DPU-BOOT CSC shall create a record of failed DRAM blocks, BIT_DRAM, in the SYSTEM_BLOCK.","initial boot sequencethe initial boot sequence, identified as Boot Sequence 1.  This processing takes place when the Bootstrap executes from Programmable Read-Only Memory (PROM).  Boot Sequence 1 is composed primarily of 4 steps as follows.First, in this sequence, EEPROM is updated.  Then, CPU BIT and a portion of DRAM BIT is performed.  Next, DRAM is cleared.  Lastly, Boot Sequence 2 is copied to DRAM and executed. During this sequence, the rest of DRAM is tested if skipBit is not set.  Load parameters are put into registers r13, r14, r15 and r16.  DRAM is cleared up to memSize.  Lastly, either the DPU-RTOS or the Bootstrap Monitor is loaded and executed according to the load parameters.",1
"  The DPU-BOOT CSC shall create a record of failed DRAM blocks, BIT_DRAM, in the SYSTEM_BLOCK.","DRAM BITPart of the memory is tested in Boot Sequence 1, and part of the memory is tested during Boot Sequence 2.  During Boot Sequence 1, ? KB of DRAM is tested before the Bootstrap is copied to this area.  During Boot Sequence 2, the  remaining memory is tested in ? KB blocks. The DRAM BIT first writes the address of each word in a block to that word in the block.   Then the test flushes the cache and reads back the entire block.  If a single-bit error occurs on the read-back, the location is read again.  If another single-bit error occurs, the test assumes a hard error and marks the whole block bad.  If a multiple-bit error occurs, the whole block is marked bad.  If the value read back does not match the address, the whole block is marked bad.  This same process is repeated with the ones complement of the address. The Bootstrap stores the results of the DRAM BIT in EEPROM as a series of x consecutive y-bit words.  Each bit in a result word represents the result of testing a ? KB block of DRAM.  These bits are mapped to DRAM by proceeding from least-significant bit (LSb) to most-significant bit (MSb) as the addresses of the memory blocks increase.  A set bit indicates that a block of DRAM has failed.  A clear bit indicates that a block of DRAM has passed the test.",1
"  The DPU-BOOT CSC shall create a record of failed DRAM blocks, BIT_DRAM, in the SYSTEM_BLOCK.","Exclude Failed DRAMThe Bootstrap performs a memory test before loading the operating system.  The results of this test are stored in the EEPROM.  The DPU-RTOS uses the results of the memory test to exclude memory segments with bit errors from the system memory pool. The Bootstrap constructs a bit map which effectively implements a list of failed memory blocks during the bootstrap built-in test.  A set of functions have been created to utilize this  bit map to exclude failed memory blocks from the VxWorks system memory pool.  The system memory pool is used by VxWorks to allocate memory dynamically.  In addition, a linked list of good memory segments is created for use by the EDAC Memory Scrubber.  These functions are called from the usrInit() and usrRoot() functions in usrConfig.c.  The dramInit() function must be called prior to kernelInit() in usrInit().  The dramBuildMemPool() function is called just prior to initialization of filesystems and drivers in usrRoot().",1
"  The DPU-BOOT CSC shall create a record of failed DRAM blocks, BIT_DRAM, in the SYSTEM_BLOCK.","Built-In Test CSCThe Built-In Test (BIT) CSC is a Level 2 reuse component from the SSFF and INSTRUMENT Y projects.  The detailed design of the BIT CSC follows. The Built-In Tests CSC, identified DPU-BIT, performs the Stage 2 Built-In Tests (BIT).  The Stage 2 BIT includes a test of the SCM EDAC circuit, a checksum test on SCM PROM, a MIL-STD-1553B internal BIT, and a memory test of the DCI Data Buffers. The results of the BIT are recorded in the SYS_CNFG_AREA in EEPROM and are also maintained in DRAM.  If an error occurs in one of the functions performing the BIT, the test result will be reported as a failure in the test itself.",1
"  The DPU-BOOT CSC shall create a record of failed DRAM blocks, BIT_DRAM, in the SYSTEM_BLOCK.",External Program InterfacesReads the BIT results from the location pointed to by pBitResults (which is assumed to be in EEPROM) into the BIT results data structure in DRAM.,1
  The DPU-BOOT CSC shall provide a monitor which accepts commands over the RS-232 interface.,"Bootstrap MonitorThe Bootstrap Monitor checks entered commands for syntax and number of arguments, and displays an error message to the RS-232 interface if an invalid command or argument is entered.  A complete listing of these messages is given in document 7384-BSPS-01.",1
"  The Bootstrap Monitor of the DPU-BOOT CSC shall provide the capability to read from Dynamic Random Access Memory (DRAM), the VME bus, and the Input/Output Channel Controller (IOCC) on command.","Built-In TestThere are two stages of Built-In Tests (BIT) for the DPU.  The Stage 1 BIT is included in the Bootstrap program and consists of Central Processing Unit (CPU) BIT, and Dynamic Random Access Memory (DRAM) BIT.  The Stage 2 BIT is executed after the operating system is booted and is not part of the Bootstrap program.",1
"  The Bootstrap Monitor of the DPU-BOOT CSC shall provide the capability to write to Dynamic Random Access Memory (DRAM), the VME bus, and the Input/Output Channel Controller (IOCC) on command.","Built-In TestThere are two stages of Built-In Tests (BIT) for the DPU.  The Stage 1 BIT is included in the Bootstrap program and consists of Central Processing Unit (CPU) BIT, and Dynamic Random Access Memory (DRAM) BIT.  The Stage 2 BIT is executed after the operating system is booted and is not part of the Bootstrap program.",1
"  The Bootstrap Monitor of the DPU-BOOT CSC shall provide the capability to write to Dynamic Random Access Memory (DRAM), the VME bus, and the Input/Output Channel Controller (IOCC) on command.",Generic VME Driver CSCThe Generic VME (GVME) Driver CSC is a Level 1 reuse component from the INSTRUMENT Y project.  The GVME Driver provides a set of convenience routines which are useful when accessing registers and memory in the VME memory space.,1
  The Bootstrap Monitor of the DPU-BOOT CSC shall provide the capability to download configurations of the DPU-RTOS from the RS-232 interface to EEPROM on command.,"initial boot sequencethe initial boot sequence, identified as Boot Sequence 1.  This processing takes place when the Bootstrap executes from Programmable Read-Only Memory (PROM).  Boot Sequence 1 is composed primarily of 4 steps as follows.First, in this sequence, EEPROM is updated.  Then, CPU BIT and a portion of DRAM BIT is performed.  Next, DRAM is cleared.  Lastly, Boot Sequence 2 is copied to DRAM and executed. During this sequence, the rest of DRAM is tested if skipBit is not set.  Load parameters are put into registers r13, r14, r15 and r16.  DRAM is cleared up to memSize.  Lastly, either the DPU-RTOS or the Bootstrap Monitor is loaded and executed according to the load parameters.",1
  The Bootstrap Monitor of the DPU-BOOT CSC shall provide the capability to load a configuration of the DPU-RTOS from EEPROM to DRAM and start its execution on command.," Startup Sequence On flight, a power cycle can only be effected by the SCU.  A watchdog reset could be induced by the DPU FSW due to a detected, unrecoverable error, or it could occur as a by-product of the FSW entering a state in which it fails to strobe the watchdog timer.  On boot, the bootstrap tests and clears DRAM, and then proceeds to load the DPU FSW from EEPROM and executes it.  The DPU FSW then loads configuration information from EEPROM (which establishes various operational defaults) and spawns the various DPU FSW tasks. ",1
  The Bootstrap Monitor of the DPU-BOOT CSC shall provide the capability to load a configuration of the DPU-RTOS from EEPROM to DRAM and start its execution on command.,"initial boot sequencethe initial boot sequence, identified as Boot Sequence 1.  This processing takes place when the Bootstrap executes from Programmable Read-Only Memory (PROM).  Boot Sequence 1 is composed primarily of 4 steps as follows.First, in this sequence, EEPROM is updated.  Then, CPU BIT and a portion of DRAM BIT is performed.  Next, DRAM is cleared.  Lastly, Boot Sequence 2 is copied to DRAM and executed. During this sequence, the rest of DRAM is tested if skipBit is not set.  Load parameters are put into registers r13, r14, r15 and r16.  DRAM is cleared up to memSize.  Lastly, either the DPU-RTOS or the Bootstrap Monitor is loaded and executed according to the load parameters.",1
  The Bootstrap Monitor of the DPU-BOOT CSC shall provide the capability to load a configuration of the DPU-RTOS from EEPROM to DRAM and start its execution on command.,"Hardware InterfacesThe DPU-BOOTSTRAP must interface directly with the EEPROM on the Company X Communication Module.  The DPU-BOOTSTRAP accesses EEPROM as ?-bit words only.  The specific timing requirements of the EEPROM are satisfied in one of three ways:* the timing requirements are met by inserting specific wait loops (typical),* the timing requirements are met by use of the EEPROM Driver (DOWNLOAD command), andthe timing requirements are met implicitly by the amount of time which will be required to execute the intervening instructions regardless of the CPU speed setting (DRAM test logic).",1
The DPU-BOOT CSC shall test and clear DRAM on power-on using the COLD_MEM_SIZE obtained from the SYSTEM_BLOCK.,"initial boot sequencethe initial boot sequence, identified as Boot Sequence 1.  This processing takes place when the Bootstrap executes from Programmable Read-Only Memory (PROM).  Boot Sequence 1 is composed primarily of 4 steps as follows.First, in this sequence, EEPROM is updated.  Then, CPU BIT and a portion of DRAM BIT is performed.  Next, DRAM is cleared.  Lastly, Boot Sequence 2 is copied to DRAM and executed. During this sequence, the rest of DRAM is tested if skipBit is not set.  Load parameters are put into registers r13, r14, r15 and r16.  DRAM is cleared up to memSize.  Lastly, either the DPU-RTOS or the Bootstrap Monitor is loaded and executed according to the load parameters.",1
  The DPU-BOOT CSC shall provide the capability to automatically load a configuration of DPU-RTOS from EEPROM to DRAM and start its execution.," Startup SequenceThe DPU FSW is booted using PROM-resident bootstrap software.  The bootstrap software performs a basic set of built-in tests, then copies the DPU FSW from EEPROM to DRAM and executes it.  In flight, there are two methods which can trigger the DPU FSW to boot:* power-on (cold boot), or* watchdog reset (warm boot, commanded reboot).",1
  The DPU-BOOT CSC shall provide the capability to automatically load a configuration of DPU-RTOS from EEPROM to DRAM and start its execution.," Startup Sequence On flight, a power cycle can only be effected by the SCU.  A watchdog reset could be induced by the DPU FSW due to a detected, unrecoverable error, or it could occur as a by-product of the FSW entering a state in which it fails to strobe the watchdog timer.  On boot, the bootstrap tests and clears DRAM, and then proceeds to load the DPU FSW from EEPROM and executes it.  The DPU FSW then loads configuration information from EEPROM (which establishes various operational defaults) and spawns the various DPU FSW tasks. ",1
  The DPU-BOOT CSC shall provide the capability to automatically load a configuration of DPU-RTOS from EEPROM to DRAM and start its execution.,"initial boot sequencethe initial boot sequence, identified as Boot Sequence 1.  This processing takes place when the Bootstrap executes from Programmable Read-Only Memory (PROM).  Boot Sequence 1 is composed primarily of 4 steps as follows.First, in this sequence, EEPROM is updated.  Then, CPU BIT and a portion of DRAM BIT is performed.  Next, DRAM is cleared.  Lastly, Boot Sequence 2 is copied to DRAM and executed. During this sequence, the rest of DRAM is tested if skipBit is not set.  Load parameters are put into registers r13, r14, r15 and r16.  DRAM is cleared up to memSize.  Lastly, either the DPU-RTOS or the Bootstrap Monitor is loaded and executed according to the load parameters.",1
  The DPU-BOOT CSC shall provide the capability to automatically load a configuration of DPU-RTOS from EEPROM to DRAM and start its execution.,External Program InterfacesReads the BIT results from the location pointed to by pBitResults (which is assumed to be in EEPROM) into the BIT results data structure in DRAM.,1
"  The DPU-BOOT CSC shall include a CPU BIT consisting of a branch test, a fixed point test, a floating point test, an interrupt test, a timer test, and a register test.","CPU BITThe CPU BIT consists of a series of tests designed to test each of the functional units of the processor.  These include test for the Branch-Unit, the Fixed-Point Unit, the Floating-Point Unit, the Interrupt-Unit, and the Timer Unit.   Each of these tests consists of executing a few selected instructions from the this functional unit. The General Purpose Registers (GPR), the Segment Registers (SR), the Counter Register (CTR), and the Condition Register are tested for stuck-bits as part of the Branch-Unit test.  This is done by writing a 1s pattern (verified by reading it back) and then writing a 0s pattern (verified by reading it back).",1
  The DPU-BOOT CSC shall create a record of the CPU BIT in the SYSTEM_BLOCK.,"CPU BITThe CPU BIT consists of a series of tests designed to test each of the functional units of the processor.  These include test for the Branch-Unit, the Fixed-Point Unit, the Floating-Point Unit, the Interrupt-Unit, and the Timer Unit.   Each of these tests consists of executing a few selected instructions from the this functional unit. The General Purpose Registers (GPR), the Segment Registers (SR), the Counter Register (CTR), and the Condition Register are tested for stuck-bits as part of the Branch-Unit test.  This is done by writing a 1s pattern (verified by reading it back) and then writing a 0s pattern (verified by reading it back).",1
  The DPU-BOOT CSC shall create a record of the CPU BIT in the SYSTEM_BLOCK.,"Exclude Failed DRAMThe Bootstrap performs a memory test before loading the operating system.  The results of this test are stored in the EEPROM.  The DPU-RTOS uses the results of the memory test to exclude memory segments with bit errors from the system memory pool. The Bootstrap constructs a bit map which effectively implements a list of failed memory blocks during the bootstrap built-in test.  A set of functions have been created to utilize this  bit map to exclude failed memory blocks from the VxWorks system memory pool.  The system memory pool is used by VxWorks to allocate memory dynamically.  In addition, a linked list of good memory segments is created for use by the EDAC Memory Scrubber.  These functions are called from the usrInit() and usrRoot() functions in usrConfig.c.  The dramInit() function must be called prior to kernelInit() in usrInit().  The dramBuildMemPool() function is called just prior to initialization of filesystems and drivers in usrRoot().",1
  The DPU-BOOT CSC shall create a record of the CPU BIT in the SYSTEM_BLOCK.,"Built-In Test CSCThe Built-In Test (BIT) CSC is a Level 2 reuse component from the SSFF and INSTRUMENT Y projects.  The detailed design of the BIT CSC follows. The Built-In Tests CSC, identified DPU-BIT, performs the Stage 2 Built-In Tests (BIT).  The Stage 2 BIT includes a test of the SCM EDAC circuit, a checksum test on SCM PROM, a MIL-STD-1553B internal BIT, and a memory test of the DCI Data Buffers. The results of the BIT are recorded in the SYS_CNFG_AREA in EEPROM and are also maintained in DRAM.  If an error occurs in one of the functions performing the BIT, the test result will be reported as a failure in the test itself.",1
"  The DPU-BOOT CSC shall complete Stage 1 BIT, and load DPU-RTOS in less than A seconds following a hardware reset if CTS is not asserted."," Startup Sequence On flight, a power cycle can only be effected by the SCU.  A watchdog reset could be induced by the DPU FSW due to a detected, unrecoverable error, or it could occur as a by-product of the FSW entering a state in which it fails to strobe the watchdog timer.  On boot, the bootstrap tests and clears DRAM, and then proceeds to load the DPU FSW from EEPROM and executes it.  The DPU FSW then loads configuration information from EEPROM (which establishes various operational defaults) and spawns the various DPU FSW tasks. ",1
"  The DPU-BOOT CSC shall complete Stage 1 BIT, and load DPU-RTOS in less than A seconds following a hardware reset if CTS is not asserted.","initial boot sequencethe initial boot sequence, identified as Boot Sequence 1.  This processing takes place when the Bootstrap executes from Programmable Read-Only Memory (PROM).  Boot Sequence 1 is composed primarily of 4 steps as follows.First, in this sequence, EEPROM is updated.  Then, CPU BIT and a portion of DRAM BIT is performed.  Next, DRAM is cleared.  Lastly, Boot Sequence 2 is copied to DRAM and executed. During this sequence, the rest of DRAM is tested if skipBit is not set.  Load parameters are put into registers r13, r14, r15 and r16.  DRAM is cleared up to memSize.  Lastly, either the DPU-RTOS or the Bootstrap Monitor is loaded and executed according to the load parameters.",1
"  The DPU-BOOT CSC shall complete Stage 1 BIT, and load DPU-RTOS in less than A seconds following a hardware reset if CTS is not asserted.","Built-In TestThere are two stages of Built-In Tests (BIT) for the DPU.  The Stage 1 BIT is included in the Bootstrap program and consists of Central Processing Unit (CPU) BIT, and Dynamic Random Access Memory (DRAM) BIT.  The Stage 2 BIT is executed after the operating system is booted and is not part of the Bootstrap program.",1
"  The DPU-BOOT CSC shall complete Stage 1 BIT, and load DPU-RTOS in less than A seconds following a hardware reset if CTS is not asserted.","Built-In Test CSCThe Built-In Test (BIT) CSC is a Level 2 reuse component from the SSFF and INSTRUMENT Y projects.  The detailed design of the BIT CSC follows. The Built-In Tests CSC, identified DPU-BIT, performs the Stage 2 Built-In Tests (BIT).  The Stage 2 BIT includes a test of the SCM EDAC circuit, a checksum test on SCM PROM, a MIL-STD-1553B internal BIT, and a memory test of the DCI Data Buffers. The results of the BIT are recorded in the SYS_CNFG_AREA in EEPROM and are also maintained in DRAM.  If an error occurs in one of the functions performing the BIT, the test result will be reported as a failure in the test itself.",1
  The DPU-BOOT CSC shall attempt to complete its normal execution sequence following detection of any failure.,"DRAM BITPart of the memory is tested in Boot Sequence 1, and part of the memory is tested during Boot Sequence 2.  During Boot Sequence 1, ? KB of DRAM is tested before the Bootstrap is copied to this area.  During Boot Sequence 2, the  remaining memory is tested in ? KB blocks. The DRAM BIT first writes the address of each word in a block to that word in the block.   Then the test flushes the cache and reads back the entire block.  If a single-bit error occurs on the read-back, the location is read again.  If another single-bit error occurs, the test assumes a hard error and marks the whole block bad.  If a multiple-bit error occurs, the whole block is marked bad.  If the value read back does not match the address, the whole block is marked bad.  This same process is repeated with the ones complement of the address. The Bootstrap stores the results of the DRAM BIT in EEPROM as a series of x consecutive y-bit words.  Each bit in a result word represents the result of testing a ? KB block of DRAM.  These bits are mapped to DRAM by proceeding from least-significant bit (LSb) to most-significant bit (MSb) as the addresses of the memory blocks increase.  A set bit indicates that a block of DRAM has failed.  A clear bit indicates that a block of DRAM has passed the test.",1
  The DPU-BOOT CSC shall attempt to complete its normal execution sequence following detection of any failure.,"Exclude Failed DRAMThe Bootstrap performs a memory test before loading the operating system.  The results of this test are stored in the EEPROM.  The DPU-RTOS uses the results of the memory test to exclude memory segments with bit errors from the system memory pool. The Bootstrap constructs a bit map which effectively implements a list of failed memory blocks during the bootstrap built-in test.  A set of functions have been created to utilize this  bit map to exclude failed memory blocks from the VxWorks system memory pool.  The system memory pool is used by VxWorks to allocate memory dynamically.  In addition, a linked list of good memory segments is created for use by the EDAC Memory Scrubber.  These functions are called from the usrInit() and usrRoot() functions in usrConfig.c.  The dramInit() function must be called prior to kernelInit() in usrInit().  The dramBuildMemPool() function is called just prior to initialization of filesystems and drivers in usrRoot().",1
  The DPU-BOOT CSC shall attempt to complete its normal execution sequence following detection of any failure.,"Built-In Test CSCThe Built-In Test (BIT) CSC is a Level 2 reuse component from the SSFF and INSTRUMENT Y projects.  The detailed design of the BIT CSC follows. The Built-In Tests CSC, identified DPU-BIT, performs the Stage 2 Built-In Tests (BIT).  The Stage 2 BIT includes a test of the SCM EDAC circuit, a checksum test on SCM PROM, a MIL-STD-1553B internal BIT, and a memory test of the DCI Data Buffers. The results of the BIT are recorded in the SYS_CNFG_AREA in EEPROM and are also maintained in DRAM.  If an error occurs in one of the functions performing the BIT, the test result will be reported as a failure in the test itself.",1
  The DPU-BOOT CSC shall attempt to complete its normal execution sequence following detection of any failure.,Error Detection and Correction CSCThe Error Detection and Correction (EDAC) CSC is a Level 1 reuse component from the SSFF and INSTRUMENT Y projects.  The EDAC CSC consists of a set of Interrupt Service Routines (ISRs) and a Memory Scrubber Task.  The design of the INSTRUMENT Y EDAC CSC is described in document CIDPSDS-01.The only design change was to add logic to check for excessive external (SCM) EDAC interrupts.,1
