"  Image mode shall have the ability to produce a Parameterized Finding Chart, PROD_FINDING_CHART, of the image if commanded, using the algorithm described in Appendix C.  The Parameterized Finding Chart shall consist of the brightest sources. Each source shall be parameterized by its position [X,Y] and Intensity/brightness.",Event ProcessingThe Event Processor Task is also responsible for creating the Finding Chart.  The Create Finding Chart Algorithm will use the Choose Guide Stars Algorithm to find the brightest stars in the finding chart Instrument Y.  The parameterized finding chart will be created by listing the X & Y detector location of each star along with a CxC pixel matrix around the star location of the intensities. The Event Processor Task will create the necessary housekeeping for the DPA.,1
" The DPU-DPA shall produce a Parameterized Finding Chart, PROD_FINDING_CHART, that is so many bytes.","Data Processing Algorithm CSCThe DPA CSC includes the following components:* Algorithms  o Choose Guide Stars scans the bright stars in the reference frame, chooses guide stars and sets up tracking windows around the guide stars.o Drift Correction calculates the drift offset and roll of a just-completed tracking frame relative to the reference frame. o Create Finding Chart will use the above Choose Guide Stars Algorithm to find the brightest stars in the finding chart Instrument Y then creates a list of the brightest stars and their intensities.o Derive Channel Boundaries calculates a set of channel boundaries (18 numbers - 9X, 9Y) which are used by the centroiding software in the Blue Processing Electronics (BPE) in the Telescope Module.",1
"  When commanded to event mode by the ICU,  the DPU-DPA shall be capable of collecting time-tagged photon events and producing a PROD_EVENT.","Event ProcessingThe Event Processor Task, after receiving a Mode command from the ICU, configures the DPU DCI hardware, responds to the ICU with a Mode Ready message then receives detector events by calling functions tmaliWait() and tmaliNextEvent().  The Event Processor Task will collect detector events for the time period specified in the Mode command then issue a Mode Complete message to the ICU.  After issuing the Mode Complete message, the Event Processor Task will enter the Idle state.",1
  The DPU-DPA shall calculate drift with respect to the reference frame based on the established guide stars then perform a shift-and-add of the image mode data.,"Event ProcessingIf the Mode command is Instrument Y Mode, the detector events are spatially filtered to the Instrument Y window specified in the Mode command then the corresponding pixel in the Ping or Pong buffer is incremented.  If specified in the Mode command, pixels will be binned at AxA or BxB.  Also, if specified in the Mode command, a tracking frame data product will be produced for every Ping/Pong tracking frame. Instrument Y and Event Mode may be commanded simultaneously in the Mode command. If the ICU sends an XRT Position command, the Instrument Y mode and Event Mode windows will be resized to match the new window sizes in the command.",1
"  The DPU-RTOS shall be a real-time, multi-tasking operating system.","Development PlatformThe DPU FSW will be implemented in the ANSI C programming language, with some PowerPC assembly used in the Bootstrap and to implement the VME data transfer in the DCI Driver.  The host (development) platform and operating system is Sun/Solaris from Sun Microsystems, Inc.  The target platform is the RAD6000 processor which has a POWER (PowerPC-like) architecture, and executes the VxWorks 5.3.1 real-time operating system.  The cross compiler and debugger is MULTI/C/C++ 1.8.9 from Green Hills Software, Inc.",1
  The DPU-RTOS shall provide the capability to invoke user-installed Interrupt Service Routines (ISRs) in response to internal and external (VME) interrupts.,"types of external (VME) interruptsThe DPU has five types of external (VME) interrupts:* MIL-STD-1553 Interface Interrupts,* DCI Interface Interrupts,* SSI Interface Interrupts,* Memory EDAC Interrupt, and* Ethernet Interrupt (ground use only).",1
  The DPU-RTOS shall provide the capability to invoke user-installed Interrupt Service Routines (ISRs) in response to internal and external (VME) interrupts.,"interrupt service routine (ISR)The DPU responds to interrupts via an interrupt service routine (ISR).  VME interrupts are prioritized; however the DPU does not allow nested interrupts, and so any interrupts which occur while servicing another interrupt will pend until the current ISR has returned.",1
  The DPU-RTOS shall provide the capability to invoke user-installed Interrupt Service Routines (ISRs) in response to internal and external (VME) interrupts.,Generic VME Driver CSCThe Generic VME (GVME) Driver CSC is a Level 1 reuse component from the INSTRUMENT Y project.  The GVME Driver provides a set of convenience routines which are useful when accessing registers and memory in the VME memory space.,1
" At startup, the DPU-RTOS shall execute the BIT device RAM tests (cold boot only), install device drivers, execute the BIT driver loopback tests (cold boot only), and then spawn the application flight software.","External Program InterfacesPerforms the SCM EDAC test, PROM checksum test, and device loopback tests for those devices which support it.",1
  The DPU-RTOS shall include the capability to dynamically load object modules from the EEPROM.," Startup Sequence On flight, a power cycle can only be effected by the SCU.  A watchdog reset could be induced by the DPU FSW due to a detected, unrecoverable error, or it could occur as a by-product of the FSW entering a state in which it fails to strobe the watchdog timer.  On boot, the bootstrap tests and clears DRAM, and then proceeds to load the DPU FSW from EEPROM and executes it.  The DPU FSW then loads configuration information from EEPROM (which establishes various operational defaults) and spawns the various DPU FSW tasks. ",1
  The DPU-RTOS shall provide a function to allow an application program to write to the Real-Time Clock registers on the RAD6000SC CPU Module.,"Time SynchronizationThe time contained in the Clock Message is specified to be valid on the rising edge of the next 1PPS signal.  When the DPU receives the Clock Message, the 1553 ISR calls the tisTimeSync() function, forwarding the data portion of the clock message to the TIS CSC via the TIS_CLK_MSG data structure..  The tisTimeSync() function will immediately copy the spacecraft clock value to the DPU clock hardware registers. The DPU hardware is designed to latch in the new time on the rising edge of the next 1 PPS signal (the act of writing a new time to the hardware registers arms the latch function in the hardware).  Once the new time is latched, the hardware automatically disables the time latch function to avoid the potential of latching in an old time at the next 1 PPS signal.will be received within one second.  In the unlikely event a UT Delta is discarded, an event message is enqueued to ccmErrEnq() for informational purposes.",1
  The DPU-RTOS shall provide a function to allow an application program to write to the Real-Time Clock registers on the RAD6000SC CPU Module.,"Public FunctionsThis routine extracts the current spacecraft time from the clock message and writes in to the hardware clock registers to be latched by the hardware at the next 1PPS signal, and maintains a copy of the UT Delta provided in the clock message.  If the UT Delta is currently being copied by an application, the UT Delta from the current message is discarded and an event is enqueued to ccmErrEnq().  If automatic time synchronization is disabled, this routine returns with no action taken. THIS ROUTINE IS INVOKED AT INTERRUPT CONTEXT.",1
  The DPU-RTOS shall provide a function to allow an application program to write to the Real-Time Clock registers on the RAD6000SC CPU Module.,Real-Time Clock InterfaceThe Real-Time Clock (RTC) Registers of the RAD6000 are special-purpose registers not normally accessible to C language programs.  Some assembler wrapper functions provide access to these.  ,1
  The DPU-RTOS shall provide a function to allow an application program to write to the Real-Time Clock registers on the RAD6000SC CPU Module.,Real-Time Clock InterfaceThis routine gets the value of the Real-Time Clock (RTC) Registers and places the results in variables rtcu and rtcl.,1
  The DPU-RTOS shall provide a function to allow an application program to write to the Real-Time Clock registers on the RAD6000SC CPU Module.,Real-Time Clock InterfaceThis routine sets the value of the RTC Registers,1
  The DPU-RTOS shall provide a function to allow an application program to read from the Real-Time Clock registers on the RAD6000SC CPU Module.,"Structural DesignThe TIS CSC provides a library of functions to* initialize the DPU clock hardware at startup,* maintain synchronization of the DPU clock with the Spacecraft clock,* provide a function for use by other applications to retrieve the current values of the DPU clock and the UT Delta, and provide functions for use by the CCM command dispatcher to alter the configuration of the clock interface.",1
  The DPU-RTOS shall provide a function to allow an application program to read from the Real-Time Clock registers on the RAD6000SC CPU Module.,"Time RetrievalThe DPU maintains a local copy of the spacecraft clock and current UT Delta in order that the DPU FSW can timestamp data products and packets.  The TIS CSC provides a function, tisTimeGet(), which retrieves a copy of both the current DPU clock value and the most recent UT Delta value.  Time is communicated among DPU FSW applications via the TIS_TIME data structure.",1
  The DPU-RTOS shall provide a function to allow an application program to read from the Real-Time Clock registers on the RAD6000SC CPU Module.,Real-Time Clock InterfaceThe Real-Time Clock (RTC) Registers of the RAD6000 are special-purpose registers not normally accessible to C language programs.  Some assembler wrapper functions provide access to these.  ,1
  The DPU-RTOS shall provide a function to allow an application program to read from the Real-Time Clock registers on the RAD6000SC CPU Module.,Real-Time Clock InterfaceThis routine gets the value of the Real-Time Clock (RTC) Registers and places the results in variables rtcu and rtcl.,1
"  The DPU-RTOS shall exclude failed DRAM from the system memory pool based on the contents of the BIT_DRAM results in the SYSTEM_BLOCK.  The system memory table does not include the Interrupt Vector Table (IVT), nor the text and data segment.","Exclude Failed DRAMThe Bootstrap performs a memory test before loading the operating system.  The results of this test are stored in the EEPROM.  The DPU-RTOS uses the results of the memory test to exclude memory segments with bit errors from the system memory pool. The Bootstrap constructs a bit map which effectively implements a list of failed memory blocks during the bootstrap built-in test.  A set of functions have been created to utilize this  bit map to exclude failed memory blocks from the VxWorks system memory pool.  The system memory pool is used by VxWorks to allocate memory dynamically.  In addition, a linked list of good memory segments is created for use by the EDAC Memory Scrubber.  These functions are called from the usrInit() and usrRoot() functions in usrConfig.c.  The dramInit() function must be called prior to kernelInit() in usrInit().  The dramBuildMemPool() function is called just prior to initialization of filesystems and drivers in usrRoot().",1
"  The DPU-RTOS shall exclude failed DRAM from the system memory pool based on the contents of the BIT_DRAM results in the SYSTEM_BLOCK.  The system memory table does not include the Interrupt Vector Table (IVT), nor the text and data segment.",External Program InterfacesReads the BIT results from the location pointed to by pBitResults (which is assumed to be in EEPROM) into the BIT results data structure in DRAM.,1
  The DPU-RTOS shall install an hook routine which is invoked on system exception which shall attempt to record the interrupt vector to the LAST_BOOT_IVEC location in EEPROM prior to reboot.,Install Exception Handlersa default interrupt handler and is installed into element five (5) of the system interrupt table.,1
  The DPU-RTOS shall install an hook routine which is invoked on system exception which shall attempt to record the interrupt vector to the LAST_BOOT_IVEC location in EEPROM prior to reboot.,Install Exception HandlersThis routine installs a hook routine for the Memory Error Interrupt.  The hook routine will be called from the interrupt context.  This function returns OK always.,1
  The DPU-RTOS shall install an hook routine which is invoked on system exception which shall attempt to record the interrupt vector to the LAST_BOOT_IVEC location in EEPROM prior to reboot.,"Install Exception Handlers The RSC processor also generates an external interrupt for the Power Fail Interrupt.  The RSCVME Board Support Package of VxWorks? does not directly support access to this interrupt.  Some custom routines must be provided to access this interrupt. These functions are described below, and are contained in sysLibSup.c.",1
  The DPU-RTOS shall install an hook routine which is invoked on system exception which shall attempt to record the interrupt vector to the LAST_BOOT_IVEC location in EEPROM prior to reboot.,Install Exception HandlersThis routine is a default interrupt handler and is installed into element six (6) of the system interrupt table.,1
  The DPU-RTOS shall install an hook routine which is invoked on system exception which shall attempt to record the interrupt vector to the LAST_BOOT_IVEC location in EEPROM prior to reboot.,Install Exception HandlersThis routine installs a hook routine for the Power Failure Interrupt.  The hook routine will be called from the interrupt context.  This function returns OK always.,1
  The DPU-RTOS shall install an hook routine which is invoked on system exception which shall attempt to record the interrupt vector to the LAST_BOOT_IVEC location in EEPROM prior to reboot.,"Install Exception Handlers Certain conditions can cause the VxWorks? exception handler to reboot the DPU.  These conditions include a Data Storage Interrupt from within an interrupt context, a Multiple-Bit Error (MBE), and a deferred-work queue overrun.  Under these circumstances, interrupting devices on the Company X Communication/Memory Module must be stopped prior to jumping back to the Bootstrap.  This can be done by installing a hook routine to perform the cleanup in sysHwInit() using the function rebootHookAdd().  However, to avoid the need to cleanup interrupts, an exception handler is installed which forces a watchdog reset, which will effectively clean up the pending interrupt problem.  The exception hook saves the contents of the Exception Stack Frame to EEPROM and waits for a watchdog timeout.  The following call is added to the usrRoot() function in usrConfig.c:",1
  The DPU-BIT shall perform two write/read/compare tests on the RAM for the MIL-STD-1553B.  The first test shall construct and write half-word (16-bit) values obtained by adding the upper and lower half-words of each each memory address.  The second test shall construct and write the ones complement of the half-word values used in the first test.,"DRAM BITPart of the memory is tested in Boot Sequence 1, and part of the memory is tested during Boot Sequence 2.  During Boot Sequence 1, ? KB of DRAM is tested before the Bootstrap is copied to this area.  During Boot Sequence 2, the  remaining memory is tested in ? KB blocks. The DRAM BIT first writes the address of each word in a block to that word in the block.   Then the test flushes the cache and reads back the entire block.  If a single-bit error occurs on the read-back, the location is read again.  If another single-bit error occurs, the test assumes a hard error and marks the whole block bad.  If a multiple-bit error occurs, the whole block is marked bad.  If the value read back does not match the address, the whole block is marked bad.  This same process is repeated with the ones complement of the address. The Bootstrap stores the results of the DRAM BIT in EEPROM as a series of x consecutive y-bit words.  Each bit in a result word represents the result of testing a ? KB block of DRAM.  These bits are mapped to DRAM by proceeding from least-significant bit (LSb) to most-significant bit (MSb) as the addresses of the memory blocks increase.  A set bit indicates that a block of DRAM has failed.  A clear bit indicates that a block of DRAM has passed the test.",1
  The DPU-BIT shall perform two write/read/compare tests on the RAM for the MIL-STD-1553B.  The first test shall construct and write half-word (16-bit) values obtained by adding the upper and lower half-words of each each memory address.  The second test shall construct and write the ones complement of the half-word values used in the first test.,"Built-In Test CSCThe Built-In Test (BIT) CSC is a Level 2 reuse component from the SSFF and INSTRUMENT Y projects.  The detailed design of the BIT CSC follows. The Built-In Tests CSC, identified DPU-BIT, performs the Stage 2 Built-In Tests (BIT).  The Stage 2 BIT includes a test of the SCM EDAC circuit, a checksum test on SCM PROM, a MIL-STD-1553B internal BIT, and a memory test of the DCI Data Buffers. The results of the BIT are recorded in the SYS_CNFG_AREA in EEPROM and are also maintained in DRAM.  If an error occurs in one of the functions performing the BIT, the test result will be reported as a failure in the test itself.",1
  The DPU-BIT shall perform MIL-STD-1553B internal BIT.,"Built-In Test CSCThe Built-In Test (BIT) CSC is a Level 2 reuse component from the SSFF and INSTRUMENT Y projects.  The detailed design of the BIT CSC follows. The Built-In Tests CSC, identified DPU-BIT, performs the Stage 2 Built-In Tests (BIT).  The Stage 2 BIT includes a test of the SCM EDAC circuit, a checksum test on SCM PROM, a MIL-STD-1553B internal BIT, and a memory test of the DCI Data Buffers. The results of the BIT are recorded in the SYS_CNFG_AREA in EEPROM and are also maintained in DRAM.  If an error occurs in one of the functions performing the BIT, the test result will be reported as a failure in the test itself.",1
  The DPU-BIT shall test the Error Detection and Correction (EDAC) on the Company X Communication/Memory Module by reading preprogrammed error locations in PROM.,"DRAM BITPart of the memory is tested in Boot Sequence 1, and part of the memory is tested during Boot Sequence 2.  During Boot Sequence 1, ? KB of DRAM is tested before the Bootstrap is copied to this area.  During Boot Sequence 2, the  remaining memory is tested in ? KB blocks. The DRAM BIT first writes the address of each word in a block to that word in the block.   Then the test flushes the cache and reads back the entire block.  If a single-bit error occurs on the read-back, the location is read again.  If another single-bit error occurs, the test assumes a hard error and marks the whole block bad.  If a multiple-bit error occurs, the whole block is marked bad.  If the value read back does not match the address, the whole block is marked bad.  This same process is repeated with the ones complement of the address. The Bootstrap stores the results of the DRAM BIT in EEPROM as a series of x consecutive y-bit words.  Each bit in a result word represents the result of testing a ? KB block of DRAM.  These bits are mapped to DRAM by proceeding from least-significant bit (LSb) to most-significant bit (MSb) as the addresses of the memory blocks increase.  A set bit indicates that a block of DRAM has failed.  A clear bit indicates that a block of DRAM has passed the test.",1
  The DPU-BIT shall perform two write/read/compare tests on the RAM for the DCI Data Buffers.  The first test shall write the address of each location to that location.  The second test shall write the ones complement of the values used in the first test.,"Built-In TestThere are two stages of Built-In Tests (BIT) for the DPU.  The Stage 1 BIT is included in the Bootstrap program and consists of Central Processing Unit (CPU) BIT, and Dynamic Random Access Memory (DRAM) BIT.  The Stage 2 BIT is executed after the operating system is booted and is not part of the Bootstrap program.",1
  The DPU-BIT shall perform two write/read/compare tests on the RAM for the DCI Data Buffers.  The first test shall write the address of each location to that location.  The second test shall write the ones complement of the values used in the first test.,"DRAM BITPart of the memory is tested in Boot Sequence 1, and part of the memory is tested during Boot Sequence 2.  During Boot Sequence 1, ? KB of DRAM is tested before the Bootstrap is copied to this area.  During Boot Sequence 2, the  remaining memory is tested in ? KB blocks. The DRAM BIT first writes the address of each word in a block to that word in the block.   Then the test flushes the cache and reads back the entire block.  If a single-bit error occurs on the read-back, the location is read again.  If another single-bit error occurs, the test assumes a hard error and marks the whole block bad.  If a multiple-bit error occurs, the whole block is marked bad.  If the value read back does not match the address, the whole block is marked bad.  This same process is repeated with the ones complement of the address. The Bootstrap stores the results of the DRAM BIT in EEPROM as a series of x consecutive y-bit words.  Each bit in a result word represents the result of testing a ? KB block of DRAM.  These bits are mapped to DRAM by proceeding from least-significant bit (LSb) to most-significant bit (MSb) as the addresses of the memory blocks increase.  A set bit indicates that a block of DRAM has failed.  A clear bit indicates that a block of DRAM has passed the test.",1
  The DPU-BIT shall report errors that occur during tests as failures in the test results.,"DRAM BITPart of the memory is tested in Boot Sequence 1, and part of the memory is tested during Boot Sequence 2.  During Boot Sequence 1, ? KB of DRAM is tested before the Bootstrap is copied to this area.  During Boot Sequence 2, the  remaining memory is tested in ? KB blocks. The DRAM BIT first writes the address of each word in a block to that word in the block.   Then the test flushes the cache and reads back the entire block.  If a single-bit error occurs on the read-back, the location is read again.  If another single-bit error occurs, the test assumes a hard error and marks the whole block bad.  If a multiple-bit error occurs, the whole block is marked bad.  If the value read back does not match the address, the whole block is marked bad.  This same process is repeated with the ones complement of the address. The Bootstrap stores the results of the DRAM BIT in EEPROM as a series of x consecutive y-bit words.  Each bit in a result word represents the result of testing a ? KB block of DRAM.  These bits are mapped to DRAM by proceeding from least-significant bit (LSb) to most-significant bit (MSb) as the addresses of the memory blocks increase.  A set bit indicates that a block of DRAM has failed.  A clear bit indicates that a block of DRAM has passed the test.",1
  The DPU-BIT shall use the 1553 Driver CSC to perform MIL-STD-1553B internal BIT.,"Built-In Test CSCThe Built-In Test (BIT) CSC is a Level 2 reuse component from the SSFF and INSTRUMENT Y projects.  The detailed design of the BIT CSC follows. The Built-In Tests CSC, identified DPU-BIT, performs the Stage 2 Built-In Tests (BIT).  The Stage 2 BIT includes a test of the SCM EDAC circuit, a checksum test on SCM PROM, a MIL-STD-1553B internal BIT, and a memory test of the DCI Data Buffers. The results of the BIT are recorded in the SYS_CNFG_AREA in EEPROM and are also maintained in DRAM.  If an error occurs in one of the functions performing the BIT, the test result will be reported as a failure in the test itself.",1
  The DPU-EDAC shall contain a background task which walks DRAM to trip single-bit errors (SBEs).,"DRAM BITPart of the memory is tested in Boot Sequence 1, and part of the memory is tested during Boot Sequence 2.  During Boot Sequence 1, ? KB of DRAM is tested before the Bootstrap is copied to this area.  During Boot Sequence 2, the  remaining memory is tested in ? KB blocks. The DRAM BIT first writes the address of each word in a block to that word in the block.   Then the test flushes the cache and reads back the entire block.  If a single-bit error occurs on the read-back, the location is read again.  If another single-bit error occurs, the test assumes a hard error and marks the whole block bad.  If a multiple-bit error occurs, the whole block is marked bad.  If the value read back does not match the address, the whole block is marked bad.  This same process is repeated with the ones complement of the address. The Bootstrap stores the results of the DRAM BIT in EEPROM as a series of x consecutive y-bit words.  Each bit in a result word represents the result of testing a ? KB block of DRAM.  These bits are mapped to DRAM by proceeding from least-significant bit (LSb) to most-significant bit (MSb) as the addresses of the memory blocks increase.  A set bit indicates that a block of DRAM has failed.  A clear bit indicates that a block of DRAM has passed the test.",1
