The DPU-BOOT CSC shall enable EDAC on the SCM.,"Public FunctionsThis routine initializes the interface to the ICU.  This routine opens SSI Driver port, installs the SSI interface interrupt callbacks, and enables Transmit Message Mode in the SSI Driver.",0
"  The Bootstrap CSC shall address hardware modules as defined in document 1400, Company X Specification for the Company X Communication/Memory Module.",Shall write Read_packet_log_msgs to Log_messages when errors occur in the Read_MODIS_packet process.  ,0
  The DPU-ADC shall read from the SCM registers in B-bit words only.,"Public FunctionsThis task initializes the TMALI CSC and then continues to read data from the DCI and store it in the TMALI buffer each time the DCI driver signals that data is available in the Ping-Pong buffer.  The availability of data in the DCI Ping-Pong buffer is signaled to the tmaliTask using a semaphore.  Unless a fatal error is detected during initialization this task will never terminate.The specified 3 parameters specify the size of the TMALI queue and the initial parameters for the DCI, if the specified values are outside the allowed range default values will be used.The specified QueueSize is the allocated buffersize (in 4 byte EVENTS), the ring buffer is full when QueueSize-1 EVENTS are stored in the buffer.",0
"  When observing a new GRB, and the XRT_POS becomes available from the ICU, the DPU-DPA shall shift and resize the image and event windows appropriately.",Shall generate data_input_status_messages if errors are encountered in reading Level_1B_Data.  ,0
 The DPU-DPA shall be able to perform tracking based on data collected from the detector by calculating the spacecraft drift using successive tracking frames using the algorithm described in Appendix C.,"InitializationThe ICUI CSC is initialized by calling icuiInit().  The icuiInit() function opens the SSI interface port to the ICU, installs the transmit and receive ISRs, and enables Transmit Message Mode in the SSI Driver CSC.  The icuiInit() function is called by the CCM Control Task at bootup.",0
The DPU-BOOT CSC shall test and clear DRAM on power-on using the COLD_MEM_SIZE obtained from the SYSTEM_BLOCK.,Public FunctionsThis routine provides a means for the CCM task to send the XRT Position command from the ICU to the DPA software. The XRT Position command shall be used to command the DPU to update the position and window parameters that it uses to spatially filter event data. ,0
  The DPU-BOOT CSC shall log detected BIT failures to the SYSTEM_BLOCK.,"Data Processing Algorithm CSCThe DPA CSC includes the following components:* Event Processor Task  communicates with the ICU, creates event list data products, creates Tracking Instrument Ys in the Ping/Pong buffers, creates the Finding Chart, performs the Engineering Modes, generates housekeeping data, creates the Event Frame, Ping and Pong buffers, and provides a task heartbeat to the CCM task.",0
 The DPU-CCM shall use DPU-ICUI to communicate with the ICU.,Install Exception HandlersThis routine is a default interrupt handler and is installed into element six (6) of the system interrupt table.,0
  The DPU-SSI shall write to the SSI registers in 16-bit words only.,"Time Interface ConfigurationThe DPU hardware provides two configuration options to the software:* selection of the active A PPS signal, and* the option to manually jam a value into the clock registers without the A PPS signal.",0
 The DPU-SCUI  shall be capable of packing created CCSDS Source Packets into STPDUs using segmented (grouped) packets for transfer to the SCU as defined by CCSDS-102.0-B-4 and in accordance with interface control document 1143-EI-S19121.,"Error Collection and ReportingAt boot time, no error queue exists because it has yet to be created.  Errors that occur in this early stage of error reporting are assigned directly to the global task variable errno.  The reader may refer to the VxWorks Programmers Guide, section 2.3.7 for more information on errno.  If errno is set after the error queues are created, it is queued to the Error Queue by calling ccmErrEnq(). ",0
  The DPU-SSI shall provide the capability for an application to determine the number of bytes in a message received from the ICU.,"External Program InterfacesPerforms the SCM EDAC test, PROM checksum test, and device loopback tests for those devices which support it.",0
"  The DPU-DCI shall read from the DCI Memory in B-bit words only, using the load multiple/store multiple instructions.",Install Exception HandlersThis routine is a default interrupt handler and is installed into element six (6) of the system interrupt table.,0
" The DPU-ICUI shall install an ISR to be invoked on the SSI receiver interblock gap interrupt, for the receiving and processing of commands from the ICU.","Development PlatformThe DPU FSW will be implemented in the ANSI C programming language, with some PowerPC assembly used in the Bootstrap and to implement the VME data transfer in the DCI Driver.  The host (development) platform and operating system is Sun/Solaris from Sun Microsystems, Inc.  The target platform is the RAD6000 processor which has a POWER (PowerPC-like) architecture, and executes the VxWorks 5.3.1 real-time operating system.  The cross compiler and debugger is MULTI/C/C++ 1.8.9 from Green Hills Software, Inc.",0
  The DPU-ADC shall read from the SCM registers in B-bit words only.,Install Exception Handlersa default interrupt handler and is installed into element five (5) of the system interrupt table.,0
  The DPU-ICUI shall receive real-time DPU_CMDs from the ICU via SSI and forward them to DPU-CCM.,Install Exception HandlersThis routine is a default interrupt handler and is installed into element six (6) of the system interrupt table.,0
  The DPU-SSI shall read from the SSI registers in 16-bit words only.,"Checksum LibraryA number of checksum algorithms are required by various system and application software modules.  In order to avoid duplication of code, the various checksum algorithms are encapsulated into a checksum library. ",0
  The DPU-TMALI shall provide a function which sets the current event bit ordering mode in the DCI driver.,"Command HandlingThe DPU accepts commands via two interfaces  from the Spacecraft via the MIL-STD-1553 interface, and from the ICU via the SSI interface.  Any of the DPU commands can be sent from the SCU or the ICU.  The source for a command from the DPU is one of the following:* ICU  command is generated and sent by the ICU via the SSI.* SCU  command is generated and sent by the SCU via the 1553.* G-ICU  command is generated on the ground and sent to the DPU via the ICU/SSI.* G-SCU  command is generated on the ground and sent to the DPU via the SCU/1553.",0
" The DPU-CCM shall spawn tasks for DPU-CCM, DPU-DPA, DPU-DCX, DPU-SCUI, and DPU-TMALI at bootup.","Public FunctionsThis routine provides a means to set the data timeout used by the DCI, the value requested indicates the timeout in milliseconds.  The initial value for the frame depth setting is determined by the parameter provided when starting the tmaliTask.  The maximum value to which the timeout can be commanded is X seconds, an attempt to set the timeout to a number larger than this maximum will result in setting the timeout to the default value of X milliseconds",0
  The DPU-DPA will complete the exposure in the time specified by the MODE command - even if it's required to truncate the final tracking frame.,"Built-In Test CSCThe Built-In Test (BIT) CSC is a Level 2 reuse component from the SSFF and INSTRUMENT Y projects.  The detailed design of the BIT CSC follows. The Built-In Tests CSC, identified DPU-BIT, performs the Stage 2 Built-In Tests (BIT).  The Stage 2 BIT includes a test of the SCM EDAC circuit, a checksum test on SCM PROM, a MIL-STD-1553B internal BIT, and a memory test of the DCI Data Buffers. The results of the BIT are recorded in the SYS_CNFG_AREA in EEPROM and are also maintained in DRAM.  If an error occurs in one of the functions performing the BIT, the test result will be reported as a failure in the test itself.",0
  The DPU-SSI shall provide the capability for an application program to enable/disable the VME Slave Interrupt on the SCM for the SSI Interface.,"Checksum LibraryA number of checksum algorithms are required by various system and application software modules.  In order to avoid duplication of code, the various checksum algorithms are encapsulated into a checksum library. ",0
  The DPU-SSI shall provide the capability for an application program to install a callback routine to respond to the transmit IBG Interrupt.,"Data ProcessingThe DCX CSC is a task which receives data packages from other tasks, compresses the data using the VBTWL algorithm, and then forwards the compressed data package to the SCUI CSC.",0
  The Bootstrap Monitor of the DPU-BOOT CSC shall output an error message to the RS-232 interface if an invalid command argument option is entered.,"Public FunctionsThis routine provides a means to set the data timeout used by the DCI, the value requested indicates the timeout in milliseconds.  The initial value for the frame depth setting is determined by the parameter provided when starting the tmaliTask.  The maximum value to which the timeout can be commanded is X seconds, an attempt to set the timeout to a number larger than this maximum will result in setting the timeout to the default value of X milliseconds",0
  The DPU-BIT shall perform MIL-STD-1553B internal BIT.,"Control and Monitoringthe CCM Control Task also handles memory dump commands.  In the event of a data dump command, the CCM Control Task will break the dump into manageable pieces and dump a small portion at a time, each time the task is awakened.  The purpose of this deferred activity is to prevent a large dump from consuming available CPU time by keeping the high-priority CCM Command Dispatch Task busy for an extended period.",0
  The Bootstrap Monitor of the DPU-BOOT CSC shall provide the capability to load a configuration of the DPU-RTOS from EEPROM to DRAM and start its execution on command.,Shall write Verify_CCSDS_log_msgs to Log_messages when errors occur in the Verify_CCSDS_header_info process.  ,0
  The DPU-DCI shall provide the capability for an application program to receive data at a rate of A bytes per second over the DCI interface.,Setting DCI Bit ArrangementThe bit arrangement of the DCI control/status register can be set via tmaliBitArrangementSet().,0
  The DPU-SSI shall read from the SSI registers in 16-bit words only.,"Public FunctionsSets the poll rate and buffer rate to the given values.  If the values are out of range, the prior values are retained and an error is reported.  The scuiTask() semaphore timeout (scuiTaskTimeout) is automatically adjusted based on the given poll rate, by setting the timeout to approximately  the poll rate (not that the timeout is expressed in clock ticks, and so the resolution is low and only approximates  of the poll rate).",0
  The DPU-DCI shall provide the capability for an application program to reset the DCI by writing to the DCI Reset Register.,"InitializationThe DCX CSC is initialized when the dcxTask() is spawned by the CCM CSC.  During initialization, the DCX CSC creates a compression queue to contain data packages which are pending compression.  Access to the compression queue is protected by a mutual exclusion semaphore.  The size of the compression queue is controlled by an initialization parameters which is passed into the dcxTask().  If the amount of memory requested cannot be allocated, initialization of the DCX CSC will fail.",0
 The DPU-CCM shall use DPU-ICUI to communicate with the ICU.,Shall write Verify_MODIS_log_msgs to Log_messages when errors occur in the Verify_MODIS_header_info process. ,0
"  The DPU-ICUI shall compute a CHKS_16 for DPU_CMDs received from the ICU.  If the expected checksum is not computed, the command will be discarded, an error will be enqueued to DPU-CCM, and a NAK message transmitted to the ICU within a second.","Public FunctionsThis function sets the frame depth of the Ping-Pong buffers used by the DCI CSC.  The frame depth determines how many frames are read into the selected Ping-Pong buffer before interrupting.  The initial value for the frame depth setting is determined by the parameter provided when starting the tmaliTask.  The maximum value to which the frame depth can be commanded is 64 frames, an attempt to command the frame depth to a value larger than this maximum will result in setting the timeout to the default value of V frames.The actual setting of the frame depth could be delayed by a small amount of time if there is activity on the DCI bus, and is typically changed when the DCI has just reported a frame level reached or timeout condition.  This minimizes the chance of changing the setting while the hardware is close to detecting a frame event.  Changing the frame depth while the DCI CSC is processing data could cause unpredictable results.  When a new tmaliDciFrameDepthSet command is send before the previous setting has been activated the new request will overwrite the previous request and the DCI will be commanded to the new value at the first available opportunity.",0
 The DPU-DCI shall provide an application program with the ability to toggle the hardware interface between Normal mode and Test mode.,"Built-In TestThere are two stages of Built-In Tests (BIT) for the DPU.  The Stage 1 BIT is included in the Bootstrap program and consists of Central Processing Unit (CPU) BIT, and Dynamic Random Access Memory (DRAM) BIT.  The Stage 2 BIT is executed after the operating system is booted and is not part of the Bootstrap program.",0
All searchable product-specific metadata in MODIS standard products shall be formatted as specified in DID 311.,"Error RecoveryExcept for the modification described in Sections 5.2.3.6, no further modifications to the existing task error-handling mechanisms are required. VxWorks? uses a global mechanism for returning status codes when errors occur.  This is accomplished  by using the task variable, errno (stored in the task control block).  Most VxWorks? functions return a STATUS value.  This value can either be OK or ERROR.  If a function returns ERROR, then the errno variable must indicate a specific error code.",0
  The DPU-ADC shall create a fixed analog conversion scan list containing the A DPU analog values (active values plus one ground reference value).,Shall write Verify_MODIS_log_msgs to Log_messages when errors occur in the Verify_MODIS_header_info process. ,0
"  The DPU-DCI shall provide the capability for an application program to set a timeout in milliseconds that specifies a period during which no new events have been received by the hardware, after which the hardware will swap ping-pong buffers and interrupt the software.","CPU BITThe CPU BIT consists of a series of tests designed to test each of the functional units of the processor.  These include test for the Branch-Unit, the Fixed-Point Unit, the Floating-Point Unit, the Interrupt-Unit, and the Timer Unit.   Each of these tests consists of executing a few selected instructions from the this functional unit. The General Purpose Registers (GPR), the Segment Registers (SR), the Counter Register (CTR), and the Condition Register are tested for stuck-bits as part of the Branch-Unit test.  This is done by writing a 1s pattern (verified by reading it back) and then writing a 0s pattern (verified by reading it back).",0
"  The DPU-BOOT CSC shall include a CPU BIT consisting of a branch test, a fixed point test, a floating point test, an interrupt test, a timer test, and a register test.","Public FunctionsThis function sets the frame depth of the Ping-Pong buffers used by the DCI CSC.  The frame depth determines how many frames are read into the selected Ping-Pong buffer before interrupting.  The initial value for the frame depth setting is determined by the parameter provided when starting the tmaliTask.  The maximum value to which the frame depth can be commanded is 64 frames, an attempt to command the frame depth to a value larger than this maximum will result in setting the timeout to the default value of V frames.The actual setting of the frame depth could be delayed by a small amount of time if there is activity on the DCI bus, and is typically changed when the DCI has just reported a frame level reached or timeout condition.  This minimizes the chance of changing the setting while the hardware is close to detecting a frame event.  Changing the frame depth while the DCI CSC is processing data could cause unpredictable results.  When a new tmaliDciFrameDepthSet command is send before the previous setting has been activated the new request will overwrite the previous request and the DCI will be commanded to the new value at the first available opportunity.",0
  The DPU-ADC shall write to the SCM registers in B-bit words only.,"Sending Messages to the ICUSome special processing and checking is required in this function to handle the transmission of the ACK/NAK message.  When a command arrives from the ICU, the icuiCmdReceiveISR() will verify the message checksum and then send an ACK/NAK message to the ICU.  It is possible that an application is in the midst of sending a message to the ICU at the time a command interrupt occurs.  However, since it is not possible for an ISR to take a semaphore, an additional mechanism is required in order to provide mutual exclusion between a task an the ISR.  To accommodate this problem, the icuiEnq() function first determines whether it is being invoked from interrupt context.  If so, it then tests the value of a static variable, icuiEnqBusy.  If the variable is set, the function will save the given ACK/NAK message parameters in static variables and return.  If the variable is not set, the function will continue as normal (avoiding the semTake() and semGive() calls).  In normal execution, the icuiEnqBusy variable is set on entry and negated on exit, after which the static variables containing the ACK/NAK message parameters will be checked to determine whether an ACK/NAK is pending.",0
 The DPU-SCUI shall be capable of receiving a telecommand from the SCU every N ms and forward it to DPU-CCM for processing.,"Data Processing Algorithm CSCThe DPA CSC includes the following components:* Event Processor Task  communicates with the ICU, creates event list data products, creates Tracking Instrument Ys in the Ping/Pong buffers, creates the Finding Chart, performs the Engineering Modes, generates housekeeping data, creates the Event Frame, Ping and Pong buffers, and provides a task heartbeat to the CCM task.",0
  The DPU-DPA shall be capable of collecting detector events over the full  FOV.,Shall generate data_input_status_messages and set scan_quality_flags if corrupted data values are detected.  ,0
  The DPU-BOOT CSC shall read from EEPROM in 32-bit words only.,External Program InterfacesReads the BIT results from the location pointed to by pBitResults (which is assumed to be in EEPROM) into the BIT results data structure in DRAM.,0
  The DPU-CCM shall process real-time non-deferred commands within B ms of receipt from the ICU or the SCU.,"Analog to Digital Converter Driver CSCThe Analog to Digital Converter (ADC) Driver CSC is a new driver which controls and retrieves data from the ADC hardware.  The key elements of the ADC driver include:* A list (array of ADC_LIST_ENTRY) which maintains the setup information and current value (ADC_VALUE) for each of the 24 ADC values. * An API function, adcUpdateNext(), which causes a single ADC_VALUE to be updated every other call to the driver.  A value is updated every other call since each value requires a multiplexer settle time as well as an ADC conversion time.  In order to keep the driver simple, the responsibility for implementing the correct settle time and conversion time rests with the application.* An API function, adcGet(), which returns a copy of the current list of ADC_VALUEs.",0
 The DPU-CCM shall record an error to the LAST_BOOT_IVEC location in EEPROM and discontinue strobing the Watchdog Timer should an unrecoverable software error occur.  An unrecoverable software error is defined as an error that causes a loss of commandability or ground communication.,"Public FunctionsThis routine is called by any CSC in order to report an error or event that should be included in DPU housekeeping.  If this routine is called from interrupt context a static global variable, ccmISRError, is set so that the error can be enqueued later (see ccmCtrlTask()).  This is done since the error/event queue is semaphore-protected and a semaphore cannot be taken in an ISR.  The error queue semaphore has priority inversion set to reduce conflicts between multiple callers should a priority inversion situation arise. This routine also replaces frequently occuring errors with a special repeat error code.  The repeat error code is a special error code that follows a normally reported error code to indicate that the normally reported error code previously reported has occurred more than once in the last high rate reporting period",0
  The Bootstrap Monitor of the DPU-BOOT CSC shall validate commands entered for syntax and number of arguments.,"Time SynchronizationThe time contained in the Clock Message is specified to be valid on the rising edge of the next 1PPS signal.  When the DPU receives the Clock Message, the 1553 ISR calls the tisTimeSync() function, forwarding the data portion of the clock message to the TIS CSC via the TIS_CLK_MSG data structure..  The tisTimeSync() function will immediately copy the spacecraft clock value to the DPU clock hardware registers. The DPU hardware is designed to latch in the new time on the rising edge of the next 1 PPS signal (the act of writing a new time to the hardware registers arms the latch function in the hardware).  Once the new time is latched, the hardware automatically disables the time latch function to avoid the potential of latching in an old time at the next 1 PPS signal.will be received within one second.  In the unlikely event a UT Delta is discarded, an event message is enqueued to ccmErrEnq() for informational purposes.",0
"  The DPU-ICUI shall check the length of a received DPU_CMD against the message length determined by the Inter-Block Gap.  If the received value does not match, then the command will be discarded, and an error will be enqueued to DPU-CCM, and a NAK message transmitted to the ICU within a second.",The L1A/Geolocation software shall use HDF Version 4.1r1 for reading and writing all HDF files.  ,0
  The DPU-CCM shall provide the capability to echo to the spacecraft each received command from the spacecraft or the ICU.,"Time SynchronizationThe time contained in the Clock Message is specified to be valid on the rising edge of the next 1PPS signal.  When the DPU receives the Clock Message, the 1553 ISR calls the tisTimeSync() function, forwarding the data portion of the clock message to the TIS CSC via the TIS_CLK_MSG data structure..  The tisTimeSync() function will immediately copy the spacecraft clock value to the DPU clock hardware registers. The DPU hardware is designed to latch in the new time on the rising edge of the next 1 PPS signal (the act of writing a new time to the hardware registers arms the latch function in the hardware).  Once the new time is latched, the hardware automatically disables the time latch function to avoid the potential of latching in an old time at the next 1 PPS signal.will be received within one second.  In the unlikely event a UT Delta is discarded, an event message is enqueued to ccmErrEnq() for informational purposes.",0
  The DPU-BOOT CSC shall provide a monitor which accepts commands over the RS-232 interface.,"Setting Data Timeout in DCIDuring nominal operation, frames arrive approximately every 11 msecs.  The DCI hardware will generate an interrupt if event data has been received in one of the Ping-Pong buffers, and a configurable amount of time has passed during which no additional events have been received.  A data timeout interrupt is not an error, but rather typically indicates that the current exposure has been completed.  The data timeout interrupt allows the TMALI CSC to retrieve the trailing events from the DCI Ping-Pong buffer.  The function tmaliDciTimeoutSet() provides an API to the DCI Driver to allow the timeout setting to be altered.",0
