"  The Bootstrap CSC shall address hardware modules as defined in document 1400, Company X Specification for the Company X Communication/Memory Module.",Checksum LibraryThis function performs a checksum on a specified memory range.  The checksum is performed as a 32-bit additive checksum.,0
  The centroid confirmation engineering mode shall produce a PROD_CENTROID_CONF.  This mode shall divide a full frame image into a certain regions.  Each region shall be processed to form an 8x8 confirmation image.  The certain confirmation images shall be sent to the solid state recorder as one data product.,"External Program InterfacesPerforms the SCM EDAC test, PROM checksum test, and device loopback tests for those devices which support it.",0
" The DPU-SCUI  shall provide the capability to handle high priority data.  High priority data shall be processed before low priority data.  In the condition  that low priority data is being processed when new high priority data arrives, DPU-SCUI shall finish processing the low priority data and then  immediately shift all resources to processing the high priority data.","Memory Upload and Download HandlingIf more than 65535 bytes need to be uploaded, the upload file must be broken up into multiple smaller files, each less than or equal to 65535 bytes, and then each of the virtual uploads should be sent in series.  Because of the sequence numbers, the DPU FSW can receive individual upload commands out of sequence.  There is no time limit for the accomplishment of a single virtual upload, and so a long upload can continue across ground contacts.  If an upload is in progress, the last sequence number can be sent to the DPU FSW and it will report the list of missing sequence numbers via event number S_ccm_MISSING_SEQNO.  If an upload is in progress and needs to be cancelled, it can be discarded by issuing the D_MEM_DAT_CNCL command.",0
  The DPU-BOOT CSC shall attempt to complete its normal execution sequence following detection of any failure.,"Control and Monitoringthe CCM Control Task initializes the DPU FSW. It is the responsibility of the CCM Control Task to establish a successful boot.  It does so by blocking on temporary semaphores, each with a 5 second timeout, after spawning the SCU Interface Task and the CCM Command Task.  If both of these tasks report a successful initialization by giving the semaphore, the CCM Control Task toggles the BC_INDEX parameter in EEPROM to indicate a successful boot.  If either task does not report a successful initialization, the CCM Control Task disables the watchdog strobe to effect a reboot of the DPU.  The rationale for selecting the successful initialization of these two tasks as the definition of a successful boot is that the DPU FSW requires these tasks, as a minimum, to establish ground contact and provide commandability.Once this initialization is complete, the task blocks on a binary semaphore which is given by the SCUI Command ISR upon arrival of the 1 Hz Clock Message.  In the event a Clock Message does not arrive, the semaphore will time out after 1.5 seconds.  The CCM Control Task remains alive to create and transmit DPU housekeeping at the appropriate intervals, perform various periodic processing tasks, and to process memory dump commands.The final call to ccmErrEnq() is performed in order that if an error occurs in an interrupt service routine, a global variable is set to the value of the errno which is then enqueued into the Error/Event Queue as part of this tasks normal processing.",0
  The DPU-BIT shall test the Error Detection and Correction (EDAC) on the Company X Communication/Memory Module by reading preprogrammed error locations in PROM.,Watchdog LibraryThe DPU contains a hardware watchdog which must be strobed periodically in order to prevent a DPU reboot.  ,0
The DPU-DCI must provide an application program with the capability to command the DCI hardware to rearrange the bit sequence of the original detector electronic output format of each event as it is received.,Setting the DCI Bit Arrangement The bit arrangement of the DCI control/status register can be set via tmaliBitArrangementSet().,1
The DPU-RTOS must install a hook routine that is invoked in the event of a system exception and will attempt to save the interrupt vector to the LAST_BOOT_IVEC location in the EEPROM before rebooting.,Install Exception HandlersThis routine installs a hook routine for the power failure interrupt. The hook routine will be called from the interrupt context. This function always returns OK.,1
"The DPU-CCM must discreetly discard all unrecognized observation messages (i.e., messages that do not have a DPU command APID).","Data ProcessingWhen the DCX CSC compresses a data packet, the given APID is incremented by one. If the compressed copy of the data is larger than the original dataset, the original dataset will be passed to the SCUI CSC, an S_dcx_UNC_USED event is queued in ccmErrEnq() and the APID is not incremented. This way, ground systems can distinguish compressed packets from uncompressed packets.",1
The DPU-DPA must provide a task heartbeat to the DPU-CCM.,"CSC Data Processing AlgorithmThe DPA CSC includes the following components:* Instrument Y processor task creates histogrammed Y instruments, performs tracking (choose guide stars, drift correction, offset and addition ), creates the reference, accumulation, and data product buffers, and provides a task heartbeat to the CCM task.",1
The DPU-TMALI must configure the ping-pong frame limit at startup as specified by TMALI_PP_LIMIT provided during initialization. The default should be M frames and should be able to be changed dynamically.,"Public FunctionsThis function sets the frame depth of the Ping-Pong buffers used by the DCI CSC. The frame depth determines the number of frames that are read into the selected Ping-Pong buffer before interrupting. The initial value of the frame depth parameter is determined by the parameter provided when tmaliTask starts. The maximum value to which the frame depth can be controlled is 64 frames; an attempt to control the frame depth to a value greater than this maximum will result in the timeout being set to the default value of V frames. Current frame depth setting may be delayed a small amount of time if there is activity on the DCI bus, and is usually changed when the DCI has just reported a frame level reached or timeout condition . This minimizes the risk of changing the parameter while the hardware is about to detect a frame event. Changing the frame depth while the DCI CSC is processing data can cause unpredictable results. When a new tmaliDciFrameDepthSet command is sent before the previous setting has been enabled, the new request will overwrite the previous request and the DCI will be ordered to the new value at the first available opportunity.",1
The DPU-RTOS must provide a function for an application program to read from the real-time clock registers on the RAD6000SC CPU module.,"Structural DesignThe TIS CSC provides a library of functions to* initialize the DPU clock hardware at startup,* maintain synchronization of the DPU clock with the Spacecraft clock,* provide a function that can be used by others applications to retrieve current clock values from the DPU and UT Delta and provide functions to be used by the CCM command dispatcher to modify the clock interface configuration.",1
The DPU-CCM must provide the capability to send back to the spacecraft each command received from the spacecraft or the ICU.,"Time Synchronization The interface with the spacecraft as described in document 1143-EI-S19121 specifies that the spacecraft will provide a clock message to each instrument at a frequency of 1 Hz. The clock message contains two values: a value representing the current time of the spacecraft and a value representing the delta between the spacecraft time and universal time (UT), based on an epoch to be determined.",1
"The DPU-CCM must generate tasks for DPU-CCM, DPU-DPA, DPU-DCX, DPU-SCUI and DPU-TMALI at startup.","InitializationThe DPA CSC is initialized by generating the dpaEventTask() and dpaInstrument YTask() tasks. Once the tasks are generated, they create the necessary memory buffers. The dpaEventTask() then enters the idle state while waiting for a Mode command from the ICU. The YTask dpaInstrument also enters the idle state while waiting to process the Ping or Pong buffer. The default setting for compression (on or off) is retrieved from the EEPROM.",1
The DPU-BIT must test Error Detection and Correction (EDAC) on Company X&#39;s communications/memory module by reading the pre-programmed error locations in the PROM.,"DRAM BITPart of the memory is tested in boot sequence 1 and part of the memory is tested during boot sequence 2. During boot sequence 1, ? The KB of DRAM is tested before the Bootstrap is copied to this area. During boot sequence 2, the remaining memory is tested in ? KB blocks. The DRAM BIT first writes the address of each word of a block into that word of the block. Then the test clears the cache and rereads the entire block. If a single-bit error occurs during replay, the location is reread. If another single-bit error occurs, the test assumes a hardware error and marks the entire block as bad. If a multi-bit error occurs, the entire block is marked as bad. If the value read back does not match the address, the entire block is marked as bad. This same process is repeated with the 1&#39;s complements of the address. The Bootstrap stores the results of the DRAM BIT in the EEPROM as a series of x consecutive words of y bits. Each bit of a result word represents the test result of a ? KB block of DRAM. These bits are mapped onto the DRAM proceeding from the least significant bit (LSb) to the most significant bit (MSb) as the addresses of the memory blocks increase. A set bit indicates that a block of DRAM has failed. A clear bit indicates that a block of DRAM has passed the test.",1
The DPU-BOOT CSC must disable the write protection of the EEPROM on the SCM.,"Integrated Test CSCThe Integrated Test CSC (BIT) is a Tier 2 reuse component of the SSFF and INSTRUMENT Y projects. The detailed design of the BIT CSC follows. The integrated test CSC, identified DPU-BIT, performs the integrated tests (BIT) of stage 2. The stage 2 BIT includes a test of the SCM EDAC circuit, a checksum test on the SCM PROM, a MIL-STD-1553B internal BIT and a memory test of DCI data buffers. The BIT results are saved in the SYS_CNFG_AREA in the EEPROM and are also retained in the DRAM. If an error occurs in any of the functions executing the BIT, the test result will be reported as a failure in the test itself.",1
The DPU-CCM must trigger the Watchdog timer by writing to the SCM_WDR at an interval of 1 second.,Watchdog LibraryThis feature activates the system watchdog to prevent a watchdog reset.,1
The DPU-CCM must use the default startup values stored in SYSTEM_CONFIG_AREA in the EEPROM when initializing the FSW.,"Command and Control CSCThe Command and Control (CCM) CSC is a level 2 reuse component of the INSTRUMENT Y project. The Command and Control CSC includes the following components:* A control task, ccmCtrlTask(), which initializes the DPU FSW and generates other tasks at startup, schedules the production of DPU management data packets, monitors the execution of other tasks, and schedules the execution of other periodic tasks such as heartbeat message and strobe monitoring ; and* A command dispatch task, ccmCmdTask(), which receives and dispatches real-time commands received from the SCU or ICU. The main data structures include:* A static data table that tracks operational status. Data included in this table includes maintenance production rates, CCM-specific metrics, and number of orders filled.* An order queue into which orders are placed when they arrive, via an interrupt, from the ICU or SCU.* An error/event queue that accumulates error and event codes reported by the FSW DPU. These error and event codes are removed from the queue and placed in a telemetry packet at a given interval and included in the DPU management data. DPUSDS5.12.1.1.1 Flight Software Initialization The command and control CSC is initialized by generating the CCM control task, ccmCtrlTask(), from the operating system startup task, usrRoot(). Once the task is generated, it calls a function, ccmInit(), which creates the error/event queue, instantiates the necessary semaphores, and installs various ISRs. Finally, it generates the remaining tasks that make up the DPU FSW. When the CCM control task starts, it reads the DPU configuration startup defaults from SYSTEM_CONFIG_AREA in the EEPROM. If the SYSTEM_CONFIG_AREA checksum is incorrect, the hardcoded defaults are used. The CCM control task initializes the remaining CSCs by calling the applicable initialization function, or if the CSC has an associated task, by spawning the task using the VxWorks function, taskSpawn(). When the CCM control task initializes a CSC, it passes the startup defaults read from the EEPROM as parameters to the task&#39;s initialization function. In addition to its task initialization activities, ccmInit() also initializes the command length check table by calling ccmCmdLengthInit(). The order processor uses the created table to check the expected order lengths for newly received orders.",1
The DPU-TIS must allow application programs to access the current UT_DELTA.,"Structural DesignThe TIS CSC provides a library of functions to* initialize the DPU clock hardware at startup,* maintain synchronization of the DPU clock with the Spacecraft clock,* provide a function that can be used by others applications to retrieve current clock values from the DPU and UT Delta and provide functions to be used by the CCM command dispatcher to modify the clock interface configuration.",1
The DPU-BOOT CSC should display a message via RS-232 when detecting a BIT failure.,"Integrated Test CSCThe Integrated Test CSC (BIT) is a Tier 2 reuse component of the SSFF and INSTRUMENT Y projects. The detailed design of the BIT CSC follows. The integrated test CSC, identified DPU-BIT, performs the integrated tests (BIT) of stage 2. The stage 2 BIT includes a test of the SCM EDAC circuit, a checksum test on the SCM PROM, a MIL-STD-1553B internal BIT and a memory test of DCI data buffers. The BIT results are saved in the SYS_CNFG_AREA in the EEPROM and are also retained in the DRAM. If an error occurs in any of the functions executing the BIT, the test result will be reported as a failure in the test itself.",1
The DPU-TMALI must configure the DCI interface data timeout on startup as specified by TMALI_TIMEOUT provided during initialization. The default value should be N milliseconds and should be dynamically changeable.,"Public Functions This routine provides a way to obtain the current data timeout value used by the DCI. The returned value is the current timeout in milliseconds. The timeout is discussed in document 036911400, section 4.3.2.4.1.3.",1
"Image mode must have the capability to produce a parameterized results table, PROD_FINDING_CHART, of the image if commanded, using the algorithm described in Appendix C. The parameterized results table must consist of the brightest sources. Each source must be configured by its position [X,Y] and its intensity/brightness.",Event Processing The event processor task is also responsible for creating the results table. The search graph creation algorithm will use the guide star selection algorithm to find the brightest stars in the search graph of instrument Y. The parameterized search graph will be created by listing the location of the X and Y detector of each star as well as a matrix of CxC pixels around the instrument. star location of intensities. The event processor task will create the necessary housekeeping for the DPA.,1
The DPU-ICUI must provide an API for other CSCs to transmit messages to the ICU.,"CSC Instrument Control Unit InterfaceThe CSC Instrument Control Unit Interface (ICUI) is a new component that supports application-level communication with the INSTRUMENT X ICU. The ICUI CSC is primarily responsible for implementing the application protocol with the ICU as defined in document DPUICD-01. In order to achieve these goals, ICUI provides: * An ICU interface message sending function, icuiEnq(), which provides an API through which other CSCs can send messages to the ICU. * A message reader ICU ISR interface commands, icuiCmdReceiveISR(), which receives remotes from the ICU and forwards them to the command and control task for processing.* An ICU interface maintenance function, icuiHkGet(), which gathers maintenance data from the ICU interface on demand from the command and control task.",1
The DPU-CCM must trigger the Watchdog timer by writing to the SCM_WDR at an interval of 1 second.,Monitoring LibraryThe DPU contains a hardware watchdog that must be monitored periodically in order to prevent a reboot of the DPU.,1
"The DPU-DCI must allow an application program to set a timeout in milliseconds that specifies a period during which no new events have been received by the hardware, after which the hardware will exchange ping-pong buffers and will interrupt the software.","Setting Data Timeout in DCIDDuring nominal operation, frames arrive approximately every 11 ms. The DCI hardware will generate an interrupt if event data has been received in one of the Ping-Pong buffers and a configurable amount of time has passed where no additional events have been received. A data timeout interruption is not an error, but rather indicates that the current exposure has ended. The data timeout interrupt allows the TMALI CSC to recover DCI Ping-Pong buffer end events. The tmaliDciTimeoutSet() function provides an API to the DCI driver to allow the timeout setting to be changed.",1
"There should be four engineering modes associated with the detector: raw event list mode, channel boundary mode, centroid confirmation mode, and intensifier characteristics mode.",Intensifier Characteristics (IC) Engineering Mode The purpose of the Intensifier Characteristics Engineering mode is to evaluate the condition and performance of the detector. Detector events produced in high-resolution full-frame detector format are collected and histogrammed for a controlled integration time to produce a pulse height histogram.,1
The DPU-BOOT CSC must put the processor in diagnostic mode.,"Standard I/O interfaceThe write primitive does not block. The written buffer is written directly to the active part of the ping-pong buffer by the driver. This primitive is only valid in TEST mode. The write call will set errno to S_dci_MODE_ERROR and return ERROR if the driver is in NORMAL mode. In TEST mode, the driver returns the number of bytes written.",1
The DPU-SCUI must receive control messages in the form of remote control packets from the SCU and make them available to the DPU-CCM.,SCU Interface CSCThe SCU Interface (SCUI) CSC is a level 3 reuse component of the INSTRUMENT Y project. The SCUI CSC is primarily responsible for implementing the application protocol with the SCU. The SCUI CSC provides CCSDS packetization services and manages the interface between the DPU and the SCU.,1
"The DPU-ICUI must check the length of a received DPU_CMD against the length of the message determined by the inter-block interval. If the received value does not match, the command will be rejected, an error will be queued in the DPU-CCM and an NAK message will be transmitted to the ICU within 1 second.","Receiving Commands from the ICUThe interface to the ICU is via a synchronous serial interface bus (SSI), which uses inter-block space (IBG) to delimit complete messages from each other. The DPU hardware produces an interrupt when it detects an IBG interrupt, and the SSI driver provides a mechanism by which an application can install an interrupt hook routine to respond to an IBG interrupt. During initialization, the ICUI CSC installs a hook routine in the SSI driver called icuiCommandReceiveISR(), which verifies the checksum of an incoming command, transmits an ACK/NAK message to the ICU, and then sets the queued command for further processing by calling ccmCmdEnq( ).",1
"The DPU-BOOT CSC Boot Monitor shall provide the capability to read from Dynamic Random Access Memory (DRAM), VME Bus, and Input/Output Channel Controller (IOCC) on command.",Integrated TestingThere are two stages of integrated testing (BIT) for the DPU. The Step 1 BIT is included in the Bootstrap program and consists of the Central Processing Unit (CPU) BIT and the Dynamic Random Access Memory (DRAM) BIT. BIT Stage 2 is run after the operating system boots and is not part of the Bootstrap program.,1
The DPU-TMALI must place the start address of the event ring buffer in TMALI_HK.,"Public functionsThis routine initializes the interface with the ICU. This routine opens the SSI driver port, installs the SSI interface interrupt callbacks, and enables message passing mode in the SSI driver.",1
The DPU-BOOT CSC boot monitor shall provide the capability to load a DPU-RTOS configuration from EEPROM to DRAM and start its execution on command.,"Hardware InterfacesThe DPU-BOOTSTRAP must interface directly with the EEPROM on the Company X communications module. The DPU-BOOTSTRAP accesses the EEPROM only in the form of bit words?. Specific timing requirements of the EEPROM are met in one of three ways: * timing requirements are met by inserting specific (typical) wait loops, * timing requirements are met by using of the EEPROM driver (DOWNLOAD command), and the timing requirements are implicitly satisfied by the time that will be required to execute intermediate instructions regardless of the processor speed setting (DRAM test logic).",1
"The DPU-SCUI must be capable of preparing an STPDU for delivery to the SCU every M milliseconds, or must indicate a no-data condition to the SCU by maintaining a non-incrementing ST_PDU transfer request counter field.","Telemetry Output to Spacecraft 1553 Bus The SCUI CSC reads data packets in the queues and transforms them into CCSDS version 1 source packets. These source packets are then packaged into the STPDU for transmission to the SCU. This processing is carried out by scuiConvertToSTPDU(). The STPDU, prefixed by a transfer request counter (TRC), is then written to fifteen sequential 1553 subaddresses (as described in Company X&#39;s ICD 1553) by the scuiWrite() function.",1
"The DPU-TMALI must use SCM_DCI_SR, as well as ERRNO provided by DPU-DCI to decode errors and place them in an error queue for DPU-CCM.","Error Collection and ReportingThe DPU-CCM CSC provides a centralized error reporting interface, ccmErrEnq(), which other FSW tasks use to report errors. Every time it wakes up, ccmTask() checks if it&#39;s time to form an error/event packet to transmit to the ground. If so, ccmTask() calls ccmHkMkError() to actually create the packet and forward it to the DPU-SCUI for ground transmission.",1
"When controlled in event mode by the ICU, the DPU-DPA must be capable of collecting time-stamped photonic events and producing a PROD_EVENT.","Event Processing The event processor task, after receiving a Mode command from the ICU, configures the DPU DCI hardware, responds to the ICU with a Mode Ready message, and then receives detector events by calling the tmaliWait functions () and tmaliNextEvent(). The Event Processor task will collect detector events for the period specified in the Mode command and then send a Mode Complete message to the ICU. After issuing the Mode Complete message, the event processor task will enter the idle state.",1
The DPU-BOOT CSC must include a DRAM BIT consisting of two write/read/compare tests. The first test should write the address of each memory location to that location. The second test should write the complement of each memory location to that location.,"Boot SequenceThe FSW DPU is started using the boot software residing in the PROM. The bootstrap software performs a basic set of built-in tests, then copies the DPU FSW from EEPROM to DRAM and executes it. In flight, there are two methods that can trigger the DPU FSW to start:* power-up (cold start) or* watchdog reset (warm start, command restart).",1
"Each software process must be capable of processing input data sets with the following nominal attributes: temporal transitions, including the crossing of the Greenwich meridian, leap year, start of year, start of millennium and/or start of collecting data outside of a granule boundary. Terminator crossing, crossing of the international date line and/or Earth pole in a granule. Data day, night or mixed mode.","process input data sets with the following nominal attributes: * Temporal transitions, including the crossing of the Greenwich meridian, leap year, start of year, start of millennium and/or start of collecting data outside of a granule boundary. * Terminator crossing, international date line crossing and/or Earth pole in a granule. Data day, night or mixed mode.",1
The DPU-CCM must provide the capability to send back to the spacecraft each command received from the spacecraft or the ICU.,Command ManagementThe DPU accepts commands through two interfaces from the spacecraft via the MIL-STD-1553 interface and from the ICU via the SSI interface. Any of the DPU commands can be sent from the SCU or ICU. The source of a DPU command is one of the following:* The ICU command is generated and sent by the ICU via the SSI.* The SCU command is generated and sent by the SCU via the 1553.* The G command -ICU is generated on the ground and sent to the DPU via the ICU/SSI.* The G-SCU command is generated on the ground and sent to the DPU via the SCU/1553.,1
